;verification;data
Que_es_un_chatbot_y_como_puede_ayudarle_a_mi_empresa_de_material_ajedrec칤stico;True;<p>Entiendo que buscas mejorar tu tienda de libros y material de ajedrez. Un <strong>chatbot</strong> es un asistente virtual que interact칰a con tus clientes a trav칠s de conversaciones automatizadas. Aqu칤 te explico c칩mo puede beneficiarte:</p><br><ul><br>  <li><strong>Atenci칩n al cliente 24/7</strong>: Responde preguntas sobre disponibilidad de libros, precios y recomendaciones en cualquier momento.</li><br>  <li><strong>Asesoramiento personalizado</strong>: Ayuda a los clientes a encontrar libros o materiales espec칤ficos seg칰n su nivel y preferencias.</li><br>  <li><strong>Gesti칩n de pedidos</strong>: Facilita la realizaci칩n de pedidos y consultas sobre el estado de los mismos.</li><br></ul><br><p>쯊e gustar칤a saber m치s sobre c칩mo implementar un chatbot en tu negocio? 游땕</p>
쯈u칠_opina_sobre_el_cambio_clim치tico?;True;<p>En cuanto al <strong>cambio clim치tico</strong>, es un tema cr칤tico que afecta a todos los sectores. Las empresas pueden contribuir a la sostenibilidad mediante la implementaci칩n de tecnolog칤as que optimicen procesos y reduzcan el impacto ambiental. Si deseas discutir c칩mo un chatbot puede ayudar en este aspecto, 춰h치zmelo saber!</p>
쯈u칠_opina_sobre_el_problema_de_los_altos_precios_de_alquiler_en_la_vivienda?;True;<p>No tengo opiniones personales, pero puedo decirte que los altos precios de alquiler son un tema complejo que afecta a muchas personas. En cuanto a tu negocio de torneos de ajedrez, un <strong>chatbot</strong> puede ser una herramienta muy 칰til. Aqu칤 te explico c칩mo:</p><br><ul><br>  <li><strong>Atenci칩n al cliente</strong>: Puede responder preguntas sobre fechas, inscripciones y reglas de los torneos.</li><br>  <li><strong>Actualizaciones en tiempo real</strong>: Informa a los participantes sobre cambios en el horario o resultados.</li><br>  <li><strong>Registro automatizado</strong>: Facilita el proceso de inscripci칩n para los torneos.</li><br></ul><br><p>쯊e gustar칤a saber m치s sobre c칩mo implementar un chatbot para tu negocio? 游땕</p>
쮺u치l_es_el_n칰mero_de_telefono_de_la_empresa?;True;"<p>Si quieres ponerte en contacto con nuestra empresa, puedes hacerlo de las siguientes maneras:</p>
<p>游 Ll치manos al <strong>(+34) 623 02 57 67</strong> o escr칤benos a 游닎 <em><strong>info@1millionbot.com</strong></em>.</p>"
