;verification;data
¿Cómo_activar_el_correo_de_la_UAM?;True;"Para matricularte por primera vez necesitarás un NIA (Número de Identificación Académica) y una contraseña.

Sigue los pasos para obtener la cuenta para realizar la matrícula.

En caso de que tengas problemas para generar la contraseña, puedes contactar con el CAU en cau@uam.es o en el teléfono 914974029.

Si te incorporas a la universidad por primera vez, ya sea como personal de la UAM o como estudiante, recibirás por e-mail o SMS en el plazo de 24/48 horas tras la incorporación, o tras la formalización de la matrícula si eres estudiante, un mensaje de bienvenida con tu Identificador de usuario UAM (ID-UAM) y un código de activación para establecer una contraseña.

En caso de que no hayas recibido el mensaje de alta en el plazo indicado, o tienes alguna duda, ponte en contacto con el Centro de Atención a Usuarios (CAU) en cau@uam.es"
¿Cómo_cambiar_la_contraseña?;True;"Si has olvidado tu identificador de usuario, busca tu identificador por DNI o contacta con el CAU en cau@uam.es.
Si necesitas cambiar la contraseña, accede a https://autoservicio.uam.es/xlWebApp/ y haz clic sobre ""Generar código de activación"" del menú de opciones del lado izquierdo.
Si necesitas cambiar la contraseña y ya tienes el código de activación, accede a https://autoservicio.uam.es/xlWebApp/ y haz clic en ""Tengo Código de Activación"" del menú de opciones del lado izquierdo."
¿Cómo_contactas_con_el_CAU_para_solicitar_ayuda?;True;Puedes contactar con el CAU en cau@uam.es o llamando al teléfono 914974029.
